id,name,text,trans
0-chapter_name,,今この時の楽しみ,享受当下
0-synopsis,,アルスター島へ帰還したスカーサハは、ノイシュ達と作ったチョコチップクッキーをエルバハに手渡す。その後、騎空艇に戻ったスカーサハは、ノイシュから「今日のお礼」にとふたりきりのお茶会に誘われる。ノイシュ達と過ごす幸福な時間がいつまで続くのかと考えながらも、スカーサハは憂いを払うように今年の夏の予定についてノイシュと語り合うのだった。,回到阿尔斯特岛的斯卡哈，将和诺伊修等人一起制作的巧克力碎曲奇亲手交给埃尔芭哈。之后，回到骑空艇的斯卡哈，被诺伊修以「今天的谢礼」为由邀请参加只属于两人的茶会。一边思考着与诺伊修等人共度的幸福时光还能持续多久，斯卡哈一边仿佛要拂去这份忧虑般，与诺伊修谈论起今年夏天的计划。
1,,チョコレート作りの明くる日。\nスカーサハはアルスター島へと\n帰還していた。,制作完巧克力的第二天。\n斯卡哈回到了阿尔斯塔岛。
2,スカーサハ/斯卡哈,エルバハよ、戻ったぞ。,埃尔芭哈，我回来了。
3,エルバハ/埃尔芭哈,ディアドラ様！\nおかえりなさいませ。\nバレンタインはご堪能なさいましたか？,迪亚德拉大人！\n欢迎回来。\n您有享受情人节吗？
4,スカーサハ/斯卡哈,ああ、存分にな。,嗯，尽情享受了。
5,エルバハ/埃尔芭哈,お戻りがお早いようですが、\n何かアルスター島の異変を\nお感じに……？,您回来得很早呢，\n难道是察觉到阿尔斯特岛有什么异常……？
6,スカーサハ/斯卡哈,いや、そういう訳ではない。\n安心せよ。,不，并非如此。\n放心吧。
7,スカーサハ/斯卡哈,そなたにもこれを\n味わわせたくてな。\n持って戻ったというわけだ。,因为想让你也尝尝这个，\n所以才特地带回来的。
8,エルバハ/埃尔芭哈,まあ……！\nディアドラ様が\nお作りになったお菓子ですか？,哎呀……！\n这是迪亚德拉大人\n亲手做的点心吗？
9,スカーサハ/斯卡哈,ああ、皆で作ったものだ。\n我が侍女エルバハよ、\n日頃の感謝を受け取ってくれるな？,是啊，这是大家一起做的。\n我的侍女埃尔芭哈啊，\n你会收下这份我平日里的谢意吧。
10,エルバハ/埃尔芭哈,なんと、光栄なお言葉です。\nお心遣いに感謝いたします。,多么荣幸的话语。\n感谢您的关怀。
11,,微笑んだエルバハは、\n恭しく菓子の包みを受け取る。,埃尔芭哈微笑着，\n恭敬地接过了点心的包裹。
12,スカーサハ/斯卡哈,良く味わえ。\n吾は既に食して来たのでな、\nそれは全てそなたのものだ。,好好品尝吧。\n我已经吃过了，\n所以这些全归你了。
13,エルバハ/埃尔芭哈,ふふ、口にするのが\n楽しみにございます！,呵呵，我很期待品尝它们！
14,スカーサハ/斯卡哈,見た目は少々悪いものも\n混じっているが、\n全体的に美味ではある。,虽然里面也混了些\n卖相不太好的，\n但整体上还是很美味的。
15,スカーサハ/斯卡哈,……おおらかな舌を持つ者が\n作ったものもあるのでな。\nそなたの口に合うか案じている。,……因为有些是味觉迟钝的人所做，\n我也担心它们是否合你口味。
16,エルバハ/埃尔芭哈,…………,…………
17,エルバハ/埃尔芭哈,ディアドラ様……,迪亚德拉大人……
18,エルバハ/埃尔芭哈,……重ねて、お礼を申し上げます。\n皆様方からの贈り物、\nじっくりと賞味させていただきます。,……请允许我再次道谢。\n各位赠予的礼物，\n我会细细品尝的。
19,,丁寧に頭を下げるエルバハに、\nスカーサハは満足そうに頷く。,看着恭恭敬敬低下头的埃尔芭哈，\n斯卡哈满意地点了点头。
25,スカーサハ/斯卡哈,…………,…………
27,ノイシュ/诺伊修,スカーサハ？　戻っていたのか。\n部屋にいないので\nもう暫くかかるかと思っていた。,斯卡哈？你回来了啊。\n我看你不在房间，\n还以为要再花些时间呢。
28,スカーサハ/斯卡哈,ああ、今戻ったところだ。\n吾に何か用事があるのか？,嗯，我刚回来。\n找我有事吗？
29,ノイシュ/诺伊修,ああ。今日のお礼に、\n貴女だけのためのお茶会を\n開こうと思って。,嗯。作为今天的谢礼，\n我想只为你一个人\n举办一场茶会。
30,スカーサハ/斯卡哈,吾だけのため？\nほう、そなたも少しは\n風情のある物言いをするものだ。,只为我一个人？哦？\n你倒也会说些风雅的话了。
31,スカーサハ/斯卡哈,だが、礼をされるような\n覚えはないな。\n何か勘違いしているのではないか？,不过，我可不记得\n有做过什么值得你道谢的事。\n你是不是误会了什么？
32,ノイシュ/诺伊修,ああ、わかっている。\nただ私がそうしたいだけだ。,嗯，我明白。\n只是我个人想向你表达谢意。
33,ノイシュ/诺伊修,紅茶を淹れて来よう、\n部屋で待っていてくれ。,我去泡红茶，\n你在房间里等着吧。
35,スカーサハ/斯卡哈,ふん……勝手な奴め。,哼……真是个自说自话的家伙。
43,ノイシュ/诺伊修,どうぞ。\n取り置いておいた\nチョコチップクッキーだ。,请用。\n这是我事先预留的\n巧克力曲奇。
44,スカーサハ/斯卡哈,ふむ……茶も菓子も\n少々量が多いな。\nお前も付き合え、ノイシュ。,嗯……茶和点心的量都有些多呢。\n你也一起来吧，诺伊修。
45,ノイシュ/诺伊修,しかし……,可是……
46,スカーサハ/斯卡哈,茶会なのだろう？\nひとりで口にするのなら\n『会』とは呼ぶまい。,不是茶会吗？\n如果只有我一人享用，\n就不能称为『会』了吧。
47,ノイシュ/诺伊修,それは……確かに。\nでは、失礼する。,这……说得也是。\n那就恭敬不如从命了。
48,,スカーサハに椅子を示され、\n一礼したノイシュが腰を下ろすと\nふたりだけのお茶会が始まった。,经斯卡哈示意入座，\n诺伊修行了一礼后坐下，\n只属于两人的茶会便开始了。
54,スカーサハ/斯卡哈,それにしても……おおらかな舌の\n持ち主は指先もおおらかなようだ。\n見よ、このクッキーを。,话说回来……味觉迟钝的人\n似乎连手指也很不灵巧呢。\n看看这块曲奇。
55,スカーサハ/斯卡哈,はは、丸ばかりの中で\n随分と個性を発揮しているではないか。,哈哈，在这些圆形曲奇中\n还真是个性十足呢。
56,ノイシュ/诺伊修,あまりゆっくり\n型抜きをしてはいけない、と\nヘルエス様もおっしゃっていた……,赫尔艾斯大人也说过，\n不能用模具压得太慢……
57,ノイシュ/诺伊修,生地が温まり、抜き型に\nくっついてしまうのだそうだ。\n丁寧にと思ったんだが……,据说面糊会变热，\n然后粘在模具上。\n我是有想过一定要仔细……
58,スカーサハ/斯卡哈,はは、精進するのだな。,哈哈，那就继续努力吧。
59,ノイシュ/诺伊修,ああ、そうしよう。\n来年はもっと綺麗なクッキーを\n作らなくては。,嗯，我会的。\n明年必须做出\n更好看的曲奇来。
60,スカーサハ/斯卡哈,ほほう、どれだけ上達するか\n楽しみにしておくとしよう。,呵呵，那我就期待一下\n你能进步多少吧。
61,ノイシュ/诺伊修,貴女も作るのではないのか、\nスカーサハ？,你也会做的吧，\n斯卡哈？
62,スカーサハ/斯卡哈,ん……ああ、そうだな。\nなかなか面白い経験だった。\n次のバレンタインにも作るとするか。,嗯……是啊，你说的对。\n这还真是一次有趣的经历。\n明年情人节也这么办吧。
63,ノイシュ/诺伊修,であるならば、\n共に練習をしなくては。\nそうだろう？,既然如此，\n我们就得一起练习了。\n对吧？
64,スカーサハ/斯卡哈,確かに、吾も鍛錬が必要だな。\nそれに……永き時を過ごすのだ、\n暇潰しは多い方が良い。,确实，我也需要锻炼。\n而且……既然要度过漫长的岁月，\n消遣还是多一些比较好。
65,,軽口のように言ってのけた\nスカーサハだったが、その視線は\n紅茶の水面に浮かぶ己に向く。,斯卡哈虽然用开玩笑的语气\n说出这番话，但她的视线却\n落在红茶水面倒映的自己身上。
66,スカーサハ/斯卡哈,（……来年もまた、か）,（……明年也还会是这样吗）
67,スカーサハ/斯卡哈,（ノイシュ……今親しく交わる\nヒトの子等と、あと幾度このような\n約束ができるのだろうな……）,（诺伊修……与如今亲近交往的\n人子们，究竟还能做出多少次\n这样的约定呢……）
68,スカーサハ/斯卡哈,（この幸福な暇潰しが\nいつまで続くのか……）,（这幸福的消遣时光\n又能持续到何时呢……）
69,ノイシュ/诺伊修,スカーサハ？,斯卡哈？
70,スカーサハ/斯卡哈,ふん、来年などと如何にも悠長よ！\n吾の知らぬヒトの営みの楽しみが、\nまだまだ山ほど残っているのだ。,哼，说什么明年，真是沉得住气！\n我所不知道的人世间的乐趣，\n还多得堆积如山呢。
71,スカーサハ/斯卡哈,次にその日が来るまでに\nバレンタインのことなど忘れる程に\n心躍らせる事柄を吾に教えよ！,在下一个情人节到来之前，\n给我介绍一些能让我\n兴奋到忘记情人节的事情吧！
72,スカーサハ/斯卡哈,さぁ、ノイシュ！,说吧，诺伊修！
73,ノイシュ/诺伊修,心躍らせる、か……\nそうだな……,让人兴奋的事吗……\n说得也是……
74,ノイシュ/诺伊修,ああ！　そうだ、今年の夏は\n<span class='scene-font-place'>アウギュステ</span>へ\n足を伸ばすのはどうだろう？,啊！对了，今年夏天\n去<span class='scene-font-place'>奥古斯特</span>\n那边转转怎么样？
75,スカーサハ/斯卡哈,<span class='scene-font-place'>アウギュステ</span>？\n……ああ、星晶獣の力によって\n海を持つという島か。,<span class='scene-font-place'>奥古斯特</span>？\n……啊啊，是那个借助星晶兽之力\n而拥有了海洋的岛屿啊。
76,ノイシュ/诺伊修,その通りだ。<span class='scene-font-place'>アウギュステ</span>の商工会と\nアルスター島の間に、売買の契約を\n結ぼうという計画があるんだ。,正是。<span class='scene-font-place'>奥古斯特</span>的商会与\n阿尔斯塔岛之间\n有签订贸易合同的计划。
77,ノイシュ/诺伊修,順調に進んでいるとのことで、\nこのままなら夏頃にセルエル様と\nヘルエス様が出向くことになるそうだ。,听说进展很顺利，\n照这样下去，今年夏天塞鲁艾尔大人和\n赫尔艾斯大人应该会前去那边。
78,ノイシュ/诺伊修,私も護衛としてお供をすることに\nなっているから、スカーサハも同道し\n海を楽しんでみるのはどうだろう。,我也要作为护卫随行，\n所以斯卡哈也一起来\n享受一下大海如何？
79,スカーサハ/斯卡哈,ほほう、それは良いことを聞いた。\n仔細を議会にも訊ねてみるとしよう。,哦哦，这倒是个好消息。\n我也会向议会询问一下详情。
80,スカーサハ/斯卡哈,だが……ノイシュ。\n他人事のように言うのは\n気に食わぬぞ。,但是……诺伊修。\n你一副事不关己的语气\n让我很不高兴。
81,ノイシュ/诺伊修,…………？\n何か間違えたことを\n言っただろうか？,…………？\n我说了什么不合适的话吗？
82,スカーサハ/斯卡哈,ひとりで海に行ったところで\n何の楽しみにもならん！\n茶会と同じことだ。,我一个人去海边有什么意思！\n跟茶会是一个道理。
83,スカーサハ/斯卡哈,吾が海に向かう時には、\nお前も吾の供をせよ！,我去海边的时候，\n你也得陪着我！
84,ノイシュ/诺伊修,な、なるほど……！\n確かに、孤独なバカンスでは\n味気ない。,原、原来如此……！\n确实，一次孤单的度假\n也太无趣了。
85,ノイシュ/诺伊修,わかった。セルエル様とヘルエス様に\n共に海で過ごしていただけるよう\n私からもお願いをしておこう。,我明白了。我也会去拜托\n塞鲁艾尔大人和赫尔艾斯大人，\n希望大家能够一起在海边度过。
86,スカーサハ/斯卡哈,…………\nそうだ、お前はそういう奴だな……,…………\n是啊，你就是这样的人呢……
87,スカーサハ/斯卡哈,（まあ良い、傍についているのなら\n護衛だけで済むこともあるまい。\nヘルエスに話を通しておくか……）,（也罢，既然待在我身边，\n想必不会只甘心当个护卫吧。\n先跟赫尔艾斯通个气好了……）
88,ノイシュ/诺伊修,海に入るのは貴女も初めてだろう？\n私が御身を守らなくては。,对你来说应该也是第一次下到海里吧？\n我必须保护你的安全。
89,スカーサハ/斯卡哈,ふん、真龍たる吾を\nヒトの身で守ると？,哼，就凭区区人类之身，\n想保护身为真龙的我吗？
90,ノイシュ/诺伊修,海を甘くみてはいけない。\n塩を含む水は川や湖とは異なるのだから\n貴女とはいえ溺れる危険もあるだろう。,可不要小看大海。\n含盐的水不同于河流和湖泊，\n就算是你也有溺水的危险吧。
91,スカーサハ/斯卡哈,やれやれ……\nわかったわかった。\nせいぜい吾を守ってくれ。,哎呀哎呀……\n知道了知道了。\n那你就好好保护我吧。
92,ノイシュ/诺伊修,ああ、任せてほしい。,嗯，交给我吧。
93,スカーサハ/斯卡哈,はぁ……\n…………,唉……\n…………
94,,自らの笑みを隠すように、\nスカーサハは再び\n紅茶に口をつける。,仿佛要藏起自己的笑容一般，\n斯卡哈再次抿了一口红茶。
95,,優しい味に舌を預けながら、\n彼女はまだ見ぬ夏の海に\n思いを馳せるのだった。,她一边沉浸于温柔的味道中，\n一边放飞思绪，\n遥想着那尚未见过的夏日海洋。
info,,,scene_chr597_q3_s10
译者,,,圣代天使